{"verdict":"REVISE","confidence":0.82,"baseline_usage":{"used_baseline":true,"missing_relevant_documents":[".adversarial/runs/20260525-102814-multiturn_history_propagation_issues_investigations/history_dependent_rule_canary.json",".adversarial/runs/20260525-102814-multiturn_history_propagation_issues_investigations/history_canary_prompt_usage_summary.json",".adversarial/runs/20260525-102814-multiturn_history_propagation_issues_investigations/cumulative_history_paths.json",".adversarial/runs/20260525-102814-multiturn_history_propagation_issues_investigations/complai_sample75_repeat.json"],"contradicted_invariants":[]},"drift_handling":{"drift_report_considered":true,"unresolved_doc_code_conflicts":[]},"blocking_issues":[{"id":"BI-001","severity":"high","claim":"The plan does not fully enforce the core invariant that final delivery must not receive materially broader rule/safety context than governance decision paths; it mainly adds observability for truncated modules instead of a hard safety fallback when mismatch persists.","evidence":[{"source":"DOC","file":".adversarial/tasks/multiturn_context_alignment_implementation.md","symbol":"Critical invariant + Module Context Policies","reason":"Task requires no material governance/delivery context gap unless explicitly flagged with safe fallback."},{"source":"CODE","file":"moralstack/models/risk/estimator.py","symbol":"_format_history_for_prompt","reason":"Current behavior truncates to last 3 turns; plan keeps this as v1 behavior with metadata-only declaration."},{"source":"ASSUMPTION","file":null,"symbol":null,"reason":"If risk/deliberative outputs continue to influence routing while using truncated context, a mismatch can still affect allow/deny semantics."}],"required_fix":"Add an explicit enforcement rule: when delivery context is broader than any decision-influencing module context for multi-turn, either (a) align those modules to equivalent context, or (b) force a safe fallback path and mark mismatch."},{"id":"BI-002","severity":"high","claim":"Required calling-pattern semantics are only partially covered; plan does not explicitly commit tests/behavior for sessionless single-question calls and conversation_id-without-transcript cases as mandated.","evidence":[{"source":"DOC","file":".adversarial/tasks/multiturn_context_alignment_implementation.md","symbol":"Required Semantics by Calling Pattern (Cases 1-4)","reason":"Task requires explicit behavior for stored transcript vs governance state and unsupported-mode reporting when transcript persistence is absent."},{"source":"ASSUMPTION","file":null,"symbol":null,"reason":"Plan mentions no raw transcript persistence in v1 but does not fully specify testable behavior/logs for Case 1 and Case 3 unsupported paths."}],"required_fix":"Add explicit implementation/test steps for Case 1 and Case 3 semantics, including `history_source` values, unsupported-mode behavior, and observability assertions."}],"missing_investigations":["Verify exact context injection paths in critic/simulator/perspective/hindsight modules with concrete file-level evidence, then tie each to module policy tests.","Confirm whether existing SQLite/JSONL schemas can carry new context-shape fields without migration; if not, include migration + backward compatibility plan."],"unsafe_assumptions":["Assuming DCCL+speculative alignment alone is sufficient while other decision-influencing modules remain truncated.","Assuming SDK/proxy compliance-fast-path divergence can remain without broader semantic impact beyond final text source."],"test_gaps":["No explicit test matrix for Case 1 and Case 3 history-source semantics when only current question is sent.","No explicit negative test proving safe fallback triggers when delivery context is broader than governance context.","No explicit privacy/redaction tests for newly logged context-shape fields and transcript-derived metadata."],"documentation_update_gaps":["Plan lists docs to update but does not explicitly include `docs/modules/compliance_layer.md` and `docs/modules/server_proxy.md`, both directly affected by DCCL context semantics and proxy transcript/state distinctions.","No explicit doc acceptance check ensuring claims about multi-turn governance are tied to newly added tests per calling pattern."],"non_blocking_warnings":["`INSUFFICIENT_CONTEXT` deferral is acceptable for first patch, but orchestrator-safe integration should be tracked as a follow-up.","Documented `docs/TRACES` vs `docs/traces` rename drift should be normalized consistently in plan references."],"summary":"Plan A is directionally strong and grounded, but it needs revision before acceptance because it does not fully operationalize the no-broader-delivery-context invariant and does not completely specify/verify the mandated calling-pattern semantics (especially transcript-absent session/conversation_id paths)."}
